Annotator1	Annotator2	Annotator3	label	text clean	index
1	1	1	0	user perché le case famiglia e le comunità alloggio di roma sono rimaste senza vaccino?    le persone fragili residenti continuano ad ammalarsi nonostante vivano in sostanziale lockdown da un anno!   intanto c'è una petizione link via user	B181
1	1	1	0	user l'unica (magra) consolazione che mi da questa psicosi, è che presumibilmente la data della mia vaccinazione dovrebbe avvicinarsi in modo consistente per le  rinunce che arriveranno	B308
5	4	3	1	"mio padre mi ha salutato questa mattina con ""mi sa che non andremo a venezia il *data mio vaccino*, temo saranno costretti a sospendere astrazeneca.""  l'ottimismo è il profumo della vita e il buongiorno si vede dal mattino!"	B333
4	4	4	1	al momento sono 29.969.854 le dosi di vaccino somministrate alla popolazione italiana, mentre 9.759.934 persone hanno concluso il ciclo vaccinale sul territorio nazionale (16,47% della popolazione).	B94
4	4	4	1	"**covid: cottarelli, ‘pass? perchè un nuovo documento? basta burocrazia’**: roma, 18 apr. (adnkronos) - ""servono 2-3 mesi per creare il pass unico per chi è vaccinato, non ha link"	B371
1	1	4	0	user il vaccino protegge dalla malattia, non dall'infezione ci si può infettare anche da vaccinati, e quando succede è comunque in forma lieve e poco trasmissibile   i non vaccinati sono vulnerabili sia per l'infezione che per la malattia  1/2	B332
4	4	4	1	da lunedì 7 giugno verrà sospesa l'#attività per la somministrazione del vaccino anti-#covid presso l'#ambulatorio distrettuale della asl 3 in via xii ottobre a #genova. l’attività #vaccinale, si legge nella nota dell'#asl, “proseguirà presso l’#hub della #fiera del #mare. link	B178
4	4	4	1	vaccini lazio, weekend open day astrazeneca over 40: iscrizioni aperte: sabato e domenica 15-16 maggio per i nati dal 1981 link link	B363
1	1	1	0	sulla vaccinazione #emiliaromagna e #toscana sono al primo posto per organizzazione e somministrazione ai propri residenti è questa una delle differenze tra il riformismo del buon governo e le chiacchiere populiste un motivo in più per user segretario user	B344
3	3	3	2	107 euro al mese in più per fare da cavie. perugia, poliziotta 43enne ricoverata dopo il vaccino astrazeneca link	B317
4	4	4	1	limes:carta: la distribuzione dei vaccini link 25	B170
3	3	3	2	user user_lella user user_laffitte user per non piegarmi al vaccino, devo assolutamente cambiare lavoro. chi può aiutarmi, sappia che ho sempre fatto qualunque cosa, tranne rubare.	B124
4	1	1	0	"il discorso non è ""chi non chiude è bravo"", perché se c'è necessità si chiude. il discorso dovrebbe essere ""se decido di chiudere devo avere un piano a lungo termine (vaccini, riorganizzazione servizi, ristori..) altrimenti si sta solo prendendo tempo"	B501
1	1	1	0	utili di pfizer coprono + che adeguatamente costi e rischi adesso x evitare milioni di morti e rischi varianti x noi bisogna fare licenze obbligatorie nei paesi emergenti e/o sospendere brevetto su questo vaccino (non su quelli che verranno o su farmaci non #covid_19) #11maggio link	B17
1	1	1	0	user user gli operatori sanitari novax debbono essere licenziati in tronco per evitare rischi per gli altri	B144
1	1	1	0	.... aspettando il turno per il vaccino ma porca troooota perché al mio comune fan tutti schifo aooooo datelo a tutti wtf	B182
1	1	1	0	vaccini, figliuolo: si vada avanti con over 60, se no non ne usciamo più link	B36
4	4	3	1	user basta guardare i dati uk la delta non è per nulla la più letale,alpha e beta la surclassano,la beta ha solo percentuale decessi maggiore nel campione tra i vaccinati,ma nel computo generale tra letalità più bassa.🤦	B452
2	4	4	1	user user user user_italia qui il contenuto della interrogazione a firma armando siri e alberto bagnai al ministro speranza sui vaccini. link	B252
2	4	4	1	#vaccinicovid   vaccini e rischio trombosi: dimezzare le dosi potrebbe ridurre i rischi link via user	B307
1	1	1	0	seguivo un noto personaggio della community trash italiana ma ho visto pubblicate un sacco di cazzate e speculazioni sui vaccini da questa persona, quindi l’unfollow è stato automatico e senza alcuna pietà	B455
2	3	3	2	user user_freisa chiedo a te che mi pare sia informato. è una domanda non provocatoria, ma seria. si hanno fonti attendibili circa l'ausilio di cellule derivanti da feti morti per la ricerca o messa a punto del vaccino az o j&amp;j?	B257
3	4	3	2	@_cieloitalia user ma magari lo ha detto per evitare di essere bollato come novax. ci stava il paladino che era pronto a sbavare.	B479
4	1	1	0	con l’85% degli over 60 vaccinati, israele ha registrato un calo del 77% dei casi covid. studio nature su medical facts link	B161
1	1	4	0	leggi qui l'articolo de l'#unionesarda link  benissimo! vadano a fare i no-vax da un'altra parte!	B275
4	4	4	1	ristoranti, calcetto, pass vaccinale, mense scolastiche: al #cts i nodi da sciogliere in vista delle riaperture del #26aprile so' problemi #vaccini #covid19italia	B69
5	1	1	0	che bello sarebbe, se ci fosse un vaccino contro il covidooooooh wait!	B73
4	4	1	1	"""arrivano da firenze e cremona i primi indagati ‘no vax’. l’accusa formulata dal magistrato nei confronti di un 66enne lombardo è chiaro: “istigazione alla disobbedienza delle leggi, di ordine pubblico, in vigore a tutela della salute pubblica nel periodo di emergenza pandemica."	B171
5	4	4	1	"user ci vorrebbe onestà intellettuale di non limitare alla "" destra "" le pulsioni no vax di questo paese . erano organici ai 5 stelle  cunial , bonafede , taverna , barillari , conte . nn ricordate nulla ? #lamemoriadelcriceto"	B377
1	1	1	0	tra due ore mi vaccino link	B25
1	1	1	0	user caro massimo, almeno io, non ho idea dello stress delle strutture sanitarie. concordo che questi lockdown a singhiozzo non sono ideali, ma oggettivamente questa pandemia è devastante. piuttosto cerchiamo di stringere sulle vaccinazioni. un caro saluto alessandro	B180
1	4	1	1	"video #vaccinazioni a #frabosasottana, #cirio: ""ai nostri giovani somministrato pfizer e moderna, la scienza ci dia indicazioni chiare sull'uso dei vaccini"". ""da lunedì piemonte zona bianca"" link"	B34
3	3	3	2	user_claudio grazie per la solerzia con cui ha verificato la segnalazione. e adesso che si fa? a parer mio questa cosa è gravissima, dimostra la malafede che circonda il vaccino in italia e l’istituzionale ostilità nei confronti di chi sceglie di non farsi iniettare un siero sperimentale	B321
1	1	1	0	l’ok alla presenza di spettatori alle gare di #uefa2020 allo stadio #olimpico è un gran bel segnale di #speranza (maiuscolo e minuscolo). ora, però, urge un protocollo rigido del #cts e, soprattutto, un’accelerazione nelle #vaccinazioni. altrimenti sarà l’ennesimo, vuoto proclama	B160
3	4	4	2	user noi gente normale, definiti ignoranti, già da tempo dicevamo che se sospendevano i medici no vax, sarebbero stati in difficoltà perché non sostituibili.	B320
1	4	1	1	coronavirus | da lunedì prenotazione vaccino per over 40 in italia si lavora ai nuovi parametri del monitoraggio seconda dose pfizer | figliulo | “meglio mezzo scudo a più persone che uno intero a meno persone” – live link	B323
3	3	3	2	"la ""variante"" delta in inghilterra colpisce i vaccinati 6 volte di più dei non vaccinati. se hai capito l'antifona, indovina chi colpirà di più ad ottobre la variante ""gamma"" (proveniente stavolta dalla manciuria)? link"	B394
3	4	6	1	sul mio pianeta ideale,  gli #istigatori alla violenza che nei #mediaspazzatura offendono, minacciano e incitano all'odio, vivrebbero a 666 metri di altezza, con vento forza 4, in punta di piedi su uno spago, in perenne equilibrio instabile.   #telegram #novax link	B207
3	3	3	2	quando la finiranno di dire falsità? l'hosempre detto e sostenuto. 1 il vaccino per virus che mutano non serve. 2 il #covid19 si cura benissimo a casa 3 siamo comunque al 70% di vaccinati ma in pratica siamo messi peggio della scorsa estate?liberi tutti!   link	B395
6	1	4	0	#quellavoltachedraghi trovò un neurone nel cranio di un novax	B378
4	1	1	0	comunque il 16 ho la prima dose del vaccino 👉🏼👈🏼	B41
3	3	3	2	user non c'è nessuno che chiede se avesse fatto il vaccino.....ma pensano subito al covid  concorezzo, muore a 15 anni nella sua cameretta. ora si indaga sul covid - cronaca - link link	B183
1	1	1	0	user chi si prende la responsabilità di mandare il personale scolastico sopra i 50 anni allo sbaraglio? se la prende lei, ministro? qualcuno dovrà spiegare perché riaprire le scuole senza aver vaccinato gli insegnanti. chi ne risponderà, se qualcuno si contagia e ci lascia la pelle??	B56
3	3	2	2	user_cersei nei laboratori militari c'è la prassi di sviluppare parallelamente a ogni arma biologica il suo vaccino. link	B2
3	3	3	2	"le overdosi di vaccino… (e dovremmo essere pure contenti)"" link 91"	B174
4	4	4	1	vaccini: sileri,verosimile ripeterli ogni anno link	B204
5	1	1	0	user user il 40% di ricoverati è vaccinato non vuole dire che il 40% di vaccinati è ricoverato. le due affermazioni sono molto diverse! mi sembra che in tanti stiano equivocando…	B355
1	3	3	2	tutti leoni e poi si cagano sotto...e fanno le corse per fare il vaccino	B193
4	5	3	1	insomma, uk segue israele e vuole introdurre il pass vaccinale per l'accesso a pub, ristoranti, teatri, etc. esenzione solo per ospedali e supermercati.  questi sono i due stati più avanti con le vaccinazioni.   poi non dite che non ve l'avevo detto. link	B48
4	4	4	1	biontech e pfizer hanno sviluppato un vaccino per la variante delta e vogliono verificarne l'efficacia. le aziende chiederanno l'autorizzazione alla food and drug administration statunitense per una terza dose di richiamo, ma per l'fda due inoculazioni sono sufficienti.	B423
3	3	3	2	cosa succederà? i dati #covid miglioreranno ancora e beccamorto user frenerà, incatenando e chiudendo il paese con l’avallo di user_chigi che la mena con i #vaccini. a quel punto user reagirà? di sicuro il popolo insorgerà furiosamente. #dittaturasanitaria	B120
3	3	3	2	persino la dottoressa bolgan trova che l'unico modo per uscirne sia la disobbedienza civile. i vaccini sono l'opposto di quello che vogliono farci credere. link	B403
5	4	4	1	non ci capisco più un cazzo.(magari non da ora).il gp durerà 12 mesi ma l'effetto vaccinazione dura 6 mesi,max 8,sennò perchè parlare di 3° e 4° dose?.vorrei che mi si chiarisse.	B301
4	3	3	2	india  uomo muore appena dopo aver ricevuto la prima dose del vaccino covid   man dies shortly after taking first dose of covid vaccine in angul  link	B72
3	3	3	2	"user chissà perchè omettono sempre il fatto che c'è stata una vaccinazione poco prima del decesso..""nessuna correlazione "" però se muori in un incidente stradale e sei risultato positivo(falso probabilmente, visto che fanno più di 20 cicli di pcr) ,diventi magicamente un morto covid."	B419
3	5	3	2	il vaccino lo farei a loro! veramente è non per finta! 👎👎👎	B470
1	1	1	0	user_s 7/1.000 + 1/10.000.000 = 7,0001/1.000 = 0,70001/100.  cioè, se, e sottolineo se, fosse vero che i vaccini provocano 1 morto ogni 10 milioni di vaccinati (sono +o- questi sospetti, giusto?), la tua probabilità di morire aumenterebbe dello 0,00001%. più facile che trombi brad pitt.	B493
1	1	1	0	a questo punto però c’è da aspettarsi anche il titolo “muore all’improvviso, una settimana fa aveva prenotato il vaccino #astrazeneca” link	B84
3	4	4	1	chiedete a #vaia del vaccino #reithera #spallanzani #domenicain. confidiamo in #giovannabotteri	B271
4	4	1	1	👉 per raggiungere la vaccinazione globale da #covid19 è stata sollecitata la deroga alle norme sulla proprietà intellettuale previste dell’accordo di marrakesh #wolterskluweritalia #coronavirus #vaccini  link	B477
6	3	3	2	nessuna correlazione, ma un nesso c' è.  a chi è morto un caro ucciso dal vaccino non girano le palle neanche un po'?	B141
1	1	1	0	speranza: “entro l’estate tutti gli italiani vaccinati, questo è l’obiettivo” | video link via user	B26
3	3	3	2	user e se questi vaccini non fossero sufficienti in futuro (viste le varianti) ??? ci aggiungiamo ulteriori altri vaccini ?? ma per piacereeeeee..........!!	B468
3	5	3	2	prima di covid, qualcuno ha chiesto se le infermiere erano vaccinate contro l'influenza? no, pensavo di no. eppure l'influenza è mortale per certi gruppi di persone. l'#ipocrisia è reale &amp; è fastidiosa. gli amanti delle maschere hanno mostrato i loro veri colori. sono dei ...👇	B97
3	3	3	2	uomo del nj in ospedale con covid dopo essere stato completamente vaccinato.  ma almeno ha il suo passaporto, giusto? #earlytreatment is the key! link	B35
3	1	3	2	medico: “astrazeneca causa coaguli di sangue”. norvegia non riprende vaccinazione link	B428
3	3	3	2	"""ci stanno somministrando un vaccino ancora in sperimentazione, secondo l'agenzia del farmaco cinese è potenzialmente pericoloso"" ▷ prof. leopardi link"	B388
4	4	4	1	fauci, stiamo lavorando a vaccino anti-covid in pillole link	B219
1	4	1	0	oh sentite io mi sono truccata figa, magari rimorchio qualche militare al vaccino	B491
3	3	3	2	user sicuramente non accetterò mai #pfizer 👇 link fin'ora non ho letto nulla di simile sul #vaccino #sputnik  qualcuno che ne sappia più di me ? link	B12
1	1	1	0	covid, persi oltre 9mila posti di lavoro in abruzzo: “avanti spediti con campagna vaccini” link #abruzzo	B270
1	1	3	0	user user_vanpelt a breve sarete tutti sistemati con il vaccino obbligatorio.	B502
3	3	4	2	cosa non ci hanno detto in italia sui vaccini😱   link	B27
3	3	3	2	user è legittimo essere contro il vaccino. non buttare fumo negli occhi.	B143
1	1	1	0	user user user e quindi? i vaccinati nel 95%/99% dei casi non avranno bisogno di 300 euro di cure da cavallo e 20 mila euro di terapia intensiva.	B304
1	1	1	0	user_lorenzo user user user se non sei vaccinato non entri nei luoghi pubblici non sali nei mezzi pubblici te ne stai per conto tuo e non calpesti il diritto degli altri a non subire la tua violenza sulla base di un presunto diritto che non esiste .	B305
4	4	4	1	astrazeneca e mix vaccini, il cts respinge le accuse: “confusione non è colpa nostra”. ora il pressing del governo sulle mascherine link via user	B360
1	1	1	0	orgogliosa e grata ai nostri ragazzi in divisa che, come sempre, ci sono nel momento del bisogno.  generale #figliuolo avanti tutta con i vaccini noi di user_italia siamo al vostro fianco.	B199
1	1	1	0	ma quindi abbiamo davvero bloccato un vaccino per 30 trombosi su 5 milioni di vaccinati? #astrazeneca	B60
6	1	1	0	📯  la «categoria 4» finalmente!! (per età - da oggi i 55-59enni con esenzione per malattia cronica - ma prima di riaprire alle normali fasce d'età si faranno tutti i fragili over 60) now on user #fragili #vaccini #covid19 #lombardia link	B29
1	4	1	1	user il vaccino per il covid c’è, ma quello per la stupidità non l’hanno ancora inventato	B208
1	1	4	0	le farmacie veronesi sono tra le più virtuose a livello regionale per numero di inoculazioni effettuate: 3637 le dosi somministrate dall'inizio della campagna. vecchioni: «soddisfatti dell'apprezzamento da parte della popolazione».  leggi sul sito: link	B411
5	4	4	1	anche roberta aveva detto di non parlare di harry perche questa serata era dedicata a louis  voi harries rovinate… — madonna ma tutto bene hai fatto il vaccino  link	B250
4	4	4	1	vaccini: da lunedì le prenotazioni dei cinquantenni. 85mila dosi al giorno – ballabio news – quotidiano online di ballabio, morterone e piani dei resinelli link	B487
4	4	4	1	green pass, ricciardi: “solo per vaccinati e guariti, tampone non può bastare” link link	B408
1	1	1	0	user_patrizia una mia ex vicina di casa, gravemente obesa e diabetica, nonostante avesse la priorità del vaccino, non l'ha voluto fare. è in terapia intensiva in condizioni disperate. ma come si fa....	B300
1	5	4	1	non mi interessa quale vaccino mi fanno. mi piacciono sia la pfeiffer che la johansson.	B266
1	1	1	0	"come si chiama quella sensazione di quando vieni a sapere di un conoscente #novax della prima ora finisce in ospedale mentre i suoi parenti vaccinati non hanno neanche un raffreddore? ah sì, ""mi ride anche il buco del culo"". #vaccinazioni #covid19"	B374
3	4	3	2	byoblu:aumento delle infezione nei vaccinati. la svezia vieta l’ingresso agli israeliani   link 28	B136
5	4	4	1	ma se non si fanno le foto appena fatto il vaccino non funziona ?	B311
1	4	1	0	l'idea per il futuro di creare un vaccino che possa proteggere contemporaneamente da più coronavirus e più varianti del sars-cov-2. lo studio, in una fase molto iniziale e su animali, ha mostrato primi risultati favorevoli. link	B446
5	5	3	2	"user user “...l'ex ministro grillo ha detto che ""di vaccino non è mai morto nessuno""...  si riferiva alla bistecca..."	B262
1	1	1	0	. user qualcuno lo fermi perché ha perso il lume della ragione e lo dico da convinta sostenitrice dei vaccini	B154
1	4	1	1	user ma guarda..io mi fido ciecamente dell'operato dell'esercito, difatti ho scritto che approvo la nomina militare per i vaccini. non amo i militari significa che non amo la vita militare..e non credo sia un offesa	B453
4	4	4	1	vaccini, in piemonte si risolve il rebus dell'appuntamento per l'iniezione [di sara strippoli] [aggiornamento delle 08:00] link	B221
4	1	1	0	"vaccini, von der leyen: 'almeno 3 mesi per il passaporto ue'   ""vogliamo un passaporto verde a livello ue col quale si possa viaggiare liberamente, per affari e per andare in vacanza, oltre a godere finalmente di eventi culturali, e altro""  link"	B486
1	1	1	0	buongiorno user e roby!  finalmente ho smaltito il vaccino e oggi posso essere con voi come sempre!  #frenchgp 🇫🇷 #moto3 #motorzn user_it	B142
4	4	4	1	user già che siamo in argomento qualcuno potrebbe spiegare perché la user è penultima per la vaccinazione degli ultraottantenni affidata fin da subito  e giustamente ai medici di famiglia? user user	B238
4	4	4	1	bergamo e brescia l’annuncio di bertolaso: da domani vaccini a 30 mila persone over 60 il bollettino: 318 i morti - a brescia 901 casi - #bergamo #brescia #l’annuncio link link	B331
1	4	1	0	user però a parte i no vax ci sono altre problematiche. te lo dice un vaccinato, con unica dose di pfizer in quanto guarito 5 mesi prima della vaccinazione. del green pass nemmeno l'ombra. e non c'è verso di fare la seconda dose. benvenuti nel limbo	B364
4	5	1	1	angela da mondello si è vaccinata! così finiscono i miti!	B488
6	5	4	1	tutti gli errori europei sui vaccini - bisognava fare le scelte giuste e restare uniti ma... link	B188
1	1	1	0	user inoltre a fronte degli anziani over 80 e dai 70 ai 79 anni che è la fascia meno vaccinata e qui bisogna correre davvero bisogna fare una vaccinazione parallela con farmacisti cliniche privati per la popolazione più giovane dai 18 anni in su che è fondamentale vaccjnare	B429
1	4	4	1	user user user_claudio un virus muta in modo casuale a prescindere dai vaccini, e le varianti più contagiose diventano dominanti. le vaccinazioni sono iniziate in uk in dicembre, link la variante alpha fu scoperta in novembre da campione preso in settembre. link	B343
3	3	3	2	ci arrivano piano piano a dire #vaccino #covid obbligatorio per tutti, dalla nascita ai 125 anni ma dategli un paio di mesi. tanto ormai vaccinano pure durante la gravidanza, poi passeranno agli animali vedrete. e quello sarà il momento che i #fruttariani diventeranno tantissimi.	B313
4	1	1	0	impoante risoluzione del consiglio d’europa : vaccini per tutti senza discriminazioni di ogni genere link	B115
4	4	4	1	user mi piacerebbe essere contadino  in ogni caso in una comunità si può esprimere il proprio gradimento o critica. e in una comunità europea non ha senso che ogni nazione vada per la sua strada tra vaccinazioni e chiusure. ci vorrebbe uniformità,oppure ciao europa	B21
3	3	3	2	"l'#autopsia su francesca tuscano, l'#insegnante di 32 anni deceduta il giorno di #pasqua, ha confermato la #morte per un quadro ""#trombotico ed emorragico cerebrale"". alla giovane era stato inoculato il #vaccino #astrazeneca il 22 marzo. al momento non sarebbero emerse anomalie. link"	B434
3	3	3	2	user user__ no, sono sperimentali, leggi il bugiardino e vedrai cosa scrivono. sono vaccini sperimentali somministrati in larga scala per via della pandemia.	B105
1	4	1	0	user_grim 1. per alcune categorie di lavoratori il vaccino (antitetanico) è già obbligatorio. 2. il datore di lavoro è responsabile della salute dei lavoratori e rischia di andare sotto processo se qualche lavoratore si prende il #covid sul luogo di lavoro. continua	B499
4	4	3	1	user user user solo a parole, usa e gb si sono accaparrate il 250% dei vaccini necessari alla loro popolazione, molti paesi non hanno visto ancora una fiala, astrazeneca prodotto in india non autorizzato in eu	B43
4	4	3	1	ma i vip/politici lo sanno che possono fare il vaccino anche senza darci la prova con i selfie? viviamo benissimo anche senza.	B474
4	4	4	1	"“a palermo c’è una evidente escalation dei contagi, in particolare per la diffusione delle varianti, più aggressive. abbiamo i primi casi di virus in soggetti già vaccinati."""	B62
4	4	4	1	"gds: ""#sicilia. vaccini in farmacia, si parte il 15 luglio"" link"	B64
4	4	3	1	user una domanda, come mai il contatore delle vaccinazioni riporta una cifra di circa un milione di somministrazioni prime dosi in più rispetto alle statistiche ufficiali?	B89
3	3	3	2	user eh ma i vaccini sono indispensabili, ci salveranno da questo terribile raffreddore, dopo che tutti avranno avuto almeno 5 dosi	B370
5	4	4	1	user c’è stata molta politicizzazione in questa epidemia. il vaccino è diventato merce di scambio di voti, ed è stato sacrificato il diritto alla salute dei più fragili. questo è molto triste.	B412
1	1	1	0	mi hanno convocata per il vaccino e so felice	B521
1	1	1	0	user user_francesco user quindi non ti vaccini contro il tetano fino a che non muori di tetano perché in base alla tua esperienza personale il tetano non esiste. d'accordo.	B241
4	4	4	1	coronavirus, a matera continuano le vaccinazioni senza prenotazione link	B471
3	3	3	2	user user_0 la germania ordina e il mondo obbedisce...e non sto giustificando questa vaccinazione che non è altro che una randomizzazione forzata...ma dobbiamo smetterla di essere allocchi in ogni contesto!	B516
1	1	1	0	ad ottobre, quando ci rinchiuderanno nuovamente, ricordate che quel 30% in meno di efficacia del vaccino può comunque fare la differenza! quindi vaccinatevi! perché anche per delta, con il vaccino per lo meno non muoio, senza non so! sappiatelo! #greenpassobbligatorio #pfizerdown	B163
3	5	3	2	"ecco la prima denuncia contro la rai per la disinformazione su vaccini e cure domiciliari"" link 8"	B445
3	1	3	2	"il vaccinato infetta. e adesso come la mettiamo?"" link 10"	B405
1	1	1	0	nonni vaccinati, sono un po’ più sollevata❤️	B113
3	3	3	2	user_cersei i tre grandi paesi in forte crisi  di leadership politica,  usa, italia e francia , sono quelli con feroce controllo e persistente allarme sanitario. valido strumento  paradigmatico , vaccino  o pass, per limitare e condizionare le libertà dei cittadini ed inibire cambi di rotta.	B476
4	4	3	1	il livello di esasperazione è alto e domandare se si è vaccinati o meno sta diventando un'abitudine come chiedere una tazzina di caffè al bar. si parla sempre di privacy e protezione dei dati personali e poi in tv, te lo chiedono senza problemi. basta no? user user	B216
3	3	3	2	user_claudio appunto perché non si tratta di vaccino ma di una sperimentazione sull'uomo, sono dei veri tentativi di omicidi.	B85
1	4	1	0	"# user: covid, figliuolo: ""obiettivo tutti vaccinati entro l'estate"" link"	B9
3	3	3	2	#vaccinazioni #greenpass   chi si è vaccinato si è assunto consapevolmente dei rischi firmando una liberatoria. benissimo, dunque in base al ragionamento dei fanatici dei vaccini, le reazioni avverse vengano curate solo a pagamento.  #ultracorpi #iostoconborghi	B341
1	1	1	0	il governo prenda subito la decisione di rendere obbligatoria la vaccinazione! stiamo rischiando un blocco totale che farà molto male alla nostra economia, oltre che a tutti. smettiamola di essere ignoranti egoisti!link	B156
4	1	1	0	comunque domani torno giù a milano per la seconda dose del vaccino e poi risalgo in montagna tipo subito. sono già stanca al pensiero.	B244
1	1	1	0	i free riders del vaccino, ovvero gli scrocconi di libertà (di d. faraone) link #	B126
3	3	3	2	user tranqi che col vaccino ci dimezzano	B121
3	3	3	2	studio scientifico vaccini covid-19 .. forte risposta immunitaria infiammatoria, compresi polmoni e fegato .. . .. affaticamento, mal di testa, brividi, dolori muscolari, febbre e dolori articolari .. . .. intense reazioni infiammatorie e trombotiche .. link	B473
1	1	1	0	user vaccinazioni non se ne parla manco morti?  il lockdown è l'alternativa al vaccinarsi ... senza vaccini si va in lockdown ... con i vaccini il lockdown è una inutile vacanza!😡	B79
5	1	5	1	user user_iacoboni la metà dei no-vax che ho tra i contatti è grillina	B334
4	4	4	1	covid. al via due studi dell’iss per il monitoraggio immunologico post vaccinazione in italia link	B450
3	3	3	2	i pazzi under 50 che si fanno astrazeneca vanno fermati! governo di assassini!!!	B228
4	4	4	1	"15 milioni di dosi di vaccino j&amp;j buttati per un errore umano.  il tecnico di laboratorio minimizza: "" ho mischiato pfizer, j&amp;j, soda, lime e vodka e a me sembrava buono"""	B176
1	1	1	0	cari novax “ libertà di scelta”,  la vostra libertà finisce dove incomincia la mia di non essere contagiata da voi #novax	B151
5	1	3	0	dopo quella vaccinazione 56 anni senza nemmeno un raffreddore ! link	B122
3	3	3	2	link la proteina spike entra in circolo nel sangue e forti percentuali sono state riscontrate nella milza, nel cuore e nelle ovaie di coloro che si sono sottoposti al vaccino. un gruppo campione di 13 sanitari. 11/13!	B430
